Name,Date,Star Rating,Title in German,Review in german,Title in English,Review in English,Recommend,Product Details
Bekki,6 months ago,5,"Sitzt sehr bequem, bringt die Brust schön hervor","Nicht nur ist der BH optisch wirklich sehr schön, er sitzt auch sehr bequem und verleiht den Brüsten eine sehr schöne Form beim Tragen.Ich dachte anfangs erst, dass ich ihn eher seltener tragen werde, aber durch den wirklich schönen Tragekomfort hat sich das schnell geändert, was natürlich meinen Freund sehr gefreut hat, denn dieser finden den BH auch wirklich sehr reizend"," Sits very comfortably, brings out the chest nicely","Not only is the bra really nice to look at, it also sits very comfortably and gives the breasts a very nice shape when worn.At first I thought that I would wear it less often, but the really nice wearing comfort quickly changed that, which of course made my boyfriend very happy, because he really found the bra very charming.",Yes,"size S, Cup size C75"
Anna,1 month ago,2,Frau,"Wunderschöner BH, tolles Material, ABER:
1.) unregelmäßig verarbeitet, die Bondage-Details waren nicht gleich lang
2.) habe ihn in 70B bestellt, da aber unwattiert für meine Brustfülle - die wahrscheinlich eher einem A-Körbchen entspricht, das aber wiederum ist wegen der Bügellänge nicht passen würde - viiiiiieeeeeel zu locker, vor allem im oberen Dekolleté sehr schade", Mrs," Beautiful bra, great material, BUT:
1.) irregularly processed, the bondage details were not the same length
2.) I ordered it in 70B, because it was unpadded for my chest size - which probably corresponds to an A-cup, but that in turn is not suitable because of the temple length - viiiiiieeeeeel too loose, especially in the upper cleavage a shame",,
Daniela,2 months ago,4,"sitzt fast perfekt, angenehmer Stoff","Ich habe die gleiche Größe, 85D, genommen wie bei den vorgeformten BHs, bei denen ich den Halt und leichten Push liebe. Sitzt fast optimal, der oberste ""Bändel"" ist bei mir etwas locker.Für meinen Geschmack könnte die äußere Stoffhälfte 1cm breiter sein, da so leichtsam die Nippel blitzen. Andrerseits ist das bei dieser Art von BH vermutlich eh nicht mehr schlimm ;-)"," fits almost perfectly, comfortable fabric"," I took the same size, 85D, as the preformed bras, which I love for support and light push. Sits almost perfectly, the top ""ribbon"" is a bit loose on me.For my taste, the outer half of the fabric could be 1cm wider, as the nipples flash so easily. On the other hand, this is probably no longer a problem with this type of bra ;-)",Yes,"Size XL, Cup size D85"
Curly hair,6 months ago,4,Wunderschön aber...,"Hallo ich heisse Hannah,
ich finde das dieser BH schön und sehr reizend ist.
Und einer Frau sehr sexy macht. Allerdings finde ich es nicht in Ordnung das der ganz obere Band etwas locker ist und nicht passt aber die letzten 2 schon. Ich finde man sollte was am oberen Band ändern. Ich hoffe meine Meinung hat Ihnen weiter geholfen mit freundlichen Grüßen eure Hannah", Beautiful but ...," Hello, my name is Hannah,
I think this bra is beautiful and very charming.
And makes a woman very sexy. However, I don't think it's okay that the very top band is a bit loose and doesn't fit but the last 2 do. I think something should be changed on the upper band. I hope my opinion has helped you. Sincerely yours Hannah

",Yes,"Size M, Cup size D85"
Nikola,3 days ago,3,Schön aber die Strips sind zu lang für ein C ,Total schön aber die Strips sind zu lang für ein C Körbchen,Nice but the strips are too long for a C," Totally nice but the strips are too long for a C cup

 ",,
Hello,5 months ago,5,Sieht umwerfend aus,"Ich bin begeistert! Der BH macht ein unfassbar schönes Dekolleté. Da die Größen beim Umfang oft bei 85 enden oder schnell in größeren Größen ausverkauft sind habe ich mir einfach eine BH Verlängerung besorgt. Fällt nicht auf und es sitzt alles perfekt. Nur mal als Tipp, wenn es hier Damen gibt, die mit größeren Umfang bei Hunkemöller oft nicht fündig geworden sind", Looks amazing," I'm excited! The bra creates an incredibly beautiful cleavage. Since the sizes often end at 85 or sell out quickly in larger sizes, I simply got myself a bra extension. Not noticeable and everything fits perfectly. Just as a tip, if there are women here who have often not found what they are looking for at Hunkemöller",Yes,"Size XL, Cup size C95"
Lara,5 months ago,5,Wunderschön! ,"Ich trage immer ein 75D Körbchen, diesen BH habe ich ebenfalls in 75D bestellt und er passt wie angegossen.
Er ist super bequem und sieht wunderschön aus.
Da meine rechte Brust minimal kleiner ist als die Linke, habe ich die Nähte auf der rechten Seite einfach aufgetrennt und etwas strammer wieder zugenäht.
Super Qualität.
Das Preis-Leistungs-Verhältnis passt. ", Beautiful!,"I always wear a 75D cup, I also ordered this bra in 75D and it fits like a glove.
It's super comfortable and looks beautiful.
Since my right breast is slightly smaller than the left one, I simply separated the seams on the right side and sewn them back up a little tighter.
Great quality.
The price-performance ratio fits.",,
Billy Yoder,3 months ago,3,"Nichts für ""weichen"" Busen","Brustumfang und Körbchengröße passen an sich gut, oberes Band war nur minimal zu lang. Für bestimmte Busenformen und/oder ""weichen"" Busen ist der BH jedoch ungeeignet, weil sich die Brust im unteren Bereich des Körbchens gegen die Bänder drückt, sodass dann der von anderen Kommentatorinnen beschriebene Salami-im-Netz-Effekt ergibt. Daher ging der BH zurück."," Not for ""soft"" breasts"," Chest and cup size fit well, the upper band was only slightly too long. However, the bra is unsuitable for certain breast shapes and / or ""soft"" breasts because the breast presses against the straps in the lower area of ??the cup, resulting in the salami-in-a-net effect described by other commentators. Hence the bra went back.

",,"Size L, Cup size E80"
Martina,3 days ago,3,Unsicher,Sitzt leider nicht so gut. Die Körbchen sich etwas zu klein geschaffen. , Unsure,"Unfortunately, it doesn't sit so well. The cups are a little too small.

",,"Size M, Cup size E75"
JW,8 months ago,3,Kein Alltags BH ,"Sieht sehr gut aus aber bei größerer Oberweite kein so guter Halt. Das Gefühl, dass obere Bändchen ist zu lang, die mittleren Bändchen sind zu eng und es sieht ein wenig gequetscht aus. Fände es besser wenn diese zu verstellen wären. Da es eh nicht wirklich ein Alltags BH ist reicht das natürlich vollkommen aus aber hätte da ein bisschen mehr erwartet.",No everyday bra," Looks very good but not so good hold with a larger bust size. The feeling that the top ribbon is too long, the middle ribbons are too tight, and it looks a little squeezed. Would it be better if these could be adjusted. Since it is not really an everyday bra anyway, that is of course completely sufficient but I would have expected a little more.",Yes,"Size M, Cup size E90"
Jenny,1 month ago,5,Sexy und hinreißendes Tragegefühl,"Der BH ist angenehm zu Tragen, zaubert ein wundervolles Dekolleté und ich als Trägerin fühle mich sexy und hinreißend. Ist nicht unbedingt für den Alltag gedacht, da auf Grund des minimalen Schnittes des Stoffes über den Brustwarzen viel mehr ""frei liegt"" als sonst aber eine definitive Kaufempfehlung. Nicht nur den Partner sonden auch für einen selbst.", Sexy and adorable to wear," The bra is comfortable to wear, conjures up a wonderful cleavage and I feel sexy and gorgeous as the wearer. It is not necessarily intended for everyday use, as the minimal cut of the fabric over the nipples means that much more is ""exposed"" than would otherwise be a definitive purchase recommendation. Not only probe your partner for yourself.",Yes,"Size M, Cup size C75"
Minka,2 months ago,2,Schlechte Passform bei äußeren Brüsten,"Der BH an sich ist sehr hübsch. Leider sah er an mir ganz anders aus als auf dem Foto. Mein Busen zeigt eher nach außen, wodurch es eine Lücke zwischen BH und meinen Brüsten gab, die auch für Außenstehende leicht erkennbar war. Dieser BH ist eher für Leute, die keinen großen Abstand zwischen linker und rechter Brust haben, da könnte er schön aussehen.",Poor fit with outer breasts,"The bra itself is very pretty. Unfortunately, it looked very different on me than in the photo. My breasts are pointing outwards, which means that there was a gap between my bra and my breasts that was easily noticeable even to outsiders. This bra is more for people who don't have a lot of space between their left and right breasts, because it could look nice.",No,"Size s, Cup size C70"
Jenny,1 month ago,3,Passform gleich null,"Der Umfang passte super, bei der einen brust schaute die Brustwarze raus, bei der anderen nicht. Der untere Streifen viel zu eng, sodass es gequetscht war. Der in der Mitte saß echt gut und der obere war viel zu groß. Schade, habe mir mehr erhofft. Schicke ihn zurück und habe ihn in einer anderen Größe nochmal bestellt. Mal schauen wie er dann sitzt.",Fit equal to zero,"The circumference was great, one breast had the nipple sticking out, the other not. The bottom strip was way too tight for it to be squashed. The one in the middle was really good and the top one was way too big. It's a shame, I hoped for more. Send it back and have ordered it again in a different size. Let's see how he sits then.",,"Size M, Cup size D85"
Anonymous,,,,,,,,
